{
  "$schema": "../schema/postprocessing-factorial-plan.schema.json",
  "schema_version": "1.0.0",
  "id": "postprocessing-factorial-primary-languages-v1",
  "revision": "postprocessing-factorial-plan-4",
  "evidence_date": "2026-07-22",
  "status": "design-locked-voice-qualification-required",
  "purpose": "Select transcript-postprocessing models against controlled variation in language, content, synthesis, voice, generation, and recognition while keeping every comparison paired to the same hidden source text.",
  "source_selection": {
    "path": "benchmarks/fixtures/synthetic-roundtrip-selection.json",
    "revision": "synthetic-roundtrip-passages-4",
    "materialized_passage_slots": 30,
    "pending_passage_slots": 0,
    "execution_gate": "All 30 passage slots must be materialized, digest-pinned, rights-reviewed, and appropriate for their declared content type before the primary matrix can execute. Native-language review is optional follow-up validation and does not block the baseline."
  },
  "axes": {
    "locales": [
      "de-DE",
      "en-US",
      "es-419",
      "fr-FR",
      "pt-BR"
    ],
    "content_types": [
      "technical",
      "native-factual",
      "dialogue"
    ],
    "passages_per_content_type": 2,
    "tts_engines": [
      {
        "id": "apple-avspeechsynthesizer",
        "voice_mode": "installed-system-voice",
        "manifest_path": null,
        "sampling_policy": "repeat-without-seed"
      },
      {
        "id": "qwen3-tts-1.7b-voicedesign-mlx-audio",
        "voice_mode": "description-plus-identity-seed",
        "manifest_path": "spikes/tts-calibration/qwen3-tts-1.7b-voicedesign-bf16.json",
        "sampling_policy": "repeat-fixed-voice-identity-seed"
      },
      {
        "id": "voxtral-tts-4b-bf16-mlx-audio",
        "voice_mode": "pinned-preset",
        "manifest_path": "spikes/tts-calibration/voxtral-tts-4b-mlx-bf16.json",
        "sampling_policy": "two-seeds-plus-same-seed-control"
      }
    ],
    "voices_per_tts_engine_and_locale": 2,
    "stt_models": [
      {
        "id": "whisper-large-v3-turbo-coreml-whispercpp",
        "role": "mature-multilingual-baseline"
      },
      {
        "id": "qwen3-asr-0.6b-mlx-direct",
        "role": "compact-generative-mlx-candidate"
      },
      {
        "id": "parakeet-tdt-0.6b-v3-coreml",
        "role": "compact-transducer-control"
      }
    ],
    "deferred_stt_extension": [
      "apple-speechtranscriber",
      "voxtral-realtime-4b-mlx-direct-2400ms"
    ],
    "llm_models": [
      {
        "id": "openai/gpt-5.6-sol",
        "manifest_path": "spikes/text-generation-openrouter-reference/candidates/gpt-5.6-sol-azure-eu.json",
        "reference_two_request_cost_usd": 0.2455266
      },
      {
        "id": "google/gemini-3.6-flash",
        "manifest_path": "spikes/text-generation-openrouter-reference/candidates/gemini-3.6-flash-google-vertex-global.json",
        "reference_two_request_cost_usd": 0.071676
      },
      {
        "id": "openai/gpt-5.6-terra",
        "manifest_path": "spikes/text-generation-openrouter-reference/candidates/gpt-5.6-terra-azure-eu.json",
        "reference_two_request_cost_usd": 0.1135068
      },
      {
        "id": "moonshotai/kimi-k3",
        "manifest_path": "spikes/text-generation-openrouter-reference/candidates/kimi-k3-moonshot-int4.json",
        "reference_two_request_cost_usd": 0.1387416
      },
      {
        "id": "anthropic/claude-sonnet-5",
        "manifest_path": "spikes/text-generation-openrouter-reference/candidates/claude-sonnet-5-azure-us-east-2.json",
        "reference_two_request_cost_usd": 0.144966
      }
    ],
    "llm_repetitions": 2,
    "excluded_llm_controls": [
      {
        "id": "qwen/qwen3.7-max",
        "reason": "The only observed provider was non-ZDR and the explicitly authorized one-execution exception is consumed."
      },
      {
        "id": "openai/gpt-5.6-luna",
        "reason": "The German development screen showed only a 10% error reduction and no justification for full-matrix cost."
      },
      {
        "id": "anthropic/claude-sonnet-4.6",
        "reason": "Historical control replaced by Claude Sonnet 5."
      }
    ]
  },
  "passage_slots": [
    { "id": "de-technical-a", "locale": "de-DE", "content_type": "technical", "index": 1, "passage_id": "synthetic-de-origin", "status": "materialized", "language_review_status": "not-required" },
    { "id": "de-technical-b", "locale": "de-DE", "content_type": "technical", "index": 2, "passage_id": "synthetic-de-methods", "status": "materialized", "language_review_status": "not-required" },
    { "id": "de-native-a", "locale": "de-DE", "content_type": "native-factual", "index": 1, "passage_id": "synthetic-de-native", "status": "materialized", "language_review_status": "not-required" },
    { "id": "de-native-b", "locale": "de-DE", "content_type": "native-factual", "index": 2, "passage_id": "synthetic-de-native-2", "status": "materialized", "language_review_status": "not-required" },
    { "id": "de-dialogue-a", "locale": "de-DE", "content_type": "dialogue", "index": 1, "passage_id": "synthetic-de-dialogue", "status": "materialized", "language_review_status": "not-required" },
    { "id": "de-dialogue-b", "locale": "de-DE", "content_type": "dialogue", "index": 2, "passage_id": "synthetic-de-dialogue-2", "status": "materialized", "language_review_status": "not-required" },

    { "id": "en-technical-a", "locale": "en-US", "content_type": "technical", "index": 1, "passage_id": "synthetic-en-reasoning", "status": "materialized", "language_review_status": "not-required" },
    { "id": "en-technical-b", "locale": "en-US", "content_type": "technical", "index": 2, "passage_id": "synthetic-en-nlp", "status": "materialized", "language_review_status": "not-required" },
    { "id": "en-native-a", "locale": "en-US", "content_type": "native-factual", "index": 1, "passage_id": "synthetic-en-native", "status": "materialized", "language_review_status": "not-required" },
    { "id": "en-native-b", "locale": "en-US", "content_type": "native-factual", "index": 2, "passage_id": "synthetic-en-native-2", "status": "materialized", "language_review_status": "not-required" },
    { "id": "en-dialogue-a", "locale": "en-US", "content_type": "dialogue", "index": 1, "passage_id": "synthetic-en-dialogue", "status": "materialized", "language_review_status": "not-required" },
    { "id": "en-dialogue-b", "locale": "en-US", "content_type": "dialogue", "index": 2, "passage_id": "synthetic-en-dialogue-2", "status": "materialized", "language_review_status": "not-required" },

    { "id": "es-technical-a", "locale": "es-419", "content_type": "technical", "index": 1, "passage_id": "synthetic-es-technical", "status": "materialized", "language_review_status": "not-required" },
    { "id": "es-technical-b", "locale": "es-419", "content_type": "technical", "index": 2, "passage_id": "synthetic-es-technical-2", "status": "materialized", "language_review_status": "not-required" },
    { "id": "es-native-a", "locale": "es-419", "content_type": "native-factual", "index": 1, "passage_id": "synthetic-es-native", "status": "materialized", "language_review_status": "not-required" },
    { "id": "es-native-b", "locale": "es-419", "content_type": "native-factual", "index": 2, "passage_id": "synthetic-es-native-2", "status": "materialized", "language_review_status": "not-required" },
    { "id": "es-dialogue-a", "locale": "es-419", "content_type": "dialogue", "index": 1, "passage_id": "synthetic-es-dialogue", "status": "materialized", "language_review_status": "not-required" },
    { "id": "es-dialogue-b", "locale": "es-419", "content_type": "dialogue", "index": 2, "passage_id": "synthetic-es-dialogue-2", "status": "materialized", "language_review_status": "not-required" },

    { "id": "fr-technical-a", "locale": "fr-FR", "content_type": "technical", "index": 1, "passage_id": "synthetic-fr-technical", "status": "materialized", "language_review_status": "not-required" },
    { "id": "fr-technical-b", "locale": "fr-FR", "content_type": "technical", "index": 2, "passage_id": "synthetic-fr-technical-2", "status": "materialized", "language_review_status": "not-required" },
    { "id": "fr-native-a", "locale": "fr-FR", "content_type": "native-factual", "index": 1, "passage_id": "synthetic-fr-native", "status": "materialized", "language_review_status": "not-required" },
    { "id": "fr-native-b", "locale": "fr-FR", "content_type": "native-factual", "index": 2, "passage_id": "synthetic-fr-native-2", "status": "materialized", "language_review_status": "not-required" },
    { "id": "fr-dialogue-a", "locale": "fr-FR", "content_type": "dialogue", "index": 1, "passage_id": "synthetic-fr-dialogue", "status": "materialized", "language_review_status": "not-required" },
    { "id": "fr-dialogue-b", "locale": "fr-FR", "content_type": "dialogue", "index": 2, "passage_id": "synthetic-fr-dialogue-2", "status": "materialized", "language_review_status": "not-required" },

    { "id": "pt-technical-a", "locale": "pt-BR", "content_type": "technical", "index": 1, "passage_id": "synthetic-pt-technical", "status": "materialized", "language_review_status": "not-required" },
    { "id": "pt-technical-b", "locale": "pt-BR", "content_type": "technical", "index": 2, "passage_id": "synthetic-pt-technical-2", "status": "materialized", "language_review_status": "not-required" },
    { "id": "pt-native-a", "locale": "pt-BR", "content_type": "native-factual", "index": 1, "passage_id": "synthetic-pt-native", "status": "materialized", "language_review_status": "not-required" },
    { "id": "pt-native-b", "locale": "pt-BR", "content_type": "native-factual", "index": 2, "passage_id": "synthetic-pt-native-2", "status": "materialized", "language_review_status": "not-required" },